{"archive_digest":"sha256:cccccccccccccccccccccccccccccccccccccccccccccccccccccccccccccccc","archive_size_bytes":512,"artifact_class":"a0x-hosted-gate-a-transport","artifact_id":1001,"captured_at":"2026-08-31T12:03:00Z","created_at":"2026-08-31T12:00:00Z","expires_at":"2026-09-30T12:00:00Z","head_sha":"aaaaaaaaaaaaaaaaaaaaaaaaaaaaaaaaaaaaaaaa","repository":"MarcoPorcellato/Latent-TRIZ","run_attempt":1,"run_id":2002,"transport_profile":"a0x-hosted-gate-a-transport-v1"}
